{
  "$schema": "https://json-schema.org/draft/2020-12/schema",
  "$id": "https://first-floor.dev/schemas/0.2/scenario.schema.json",
  "title": "Scenario",
  "description": "The forward-looking assumptions a report is computed under. Kept separate from the structure document so that a position never contains a claim about the future and a scenario can be swept without touching the position (D-06, invariant 4). Every figure the core returns carries the scenario that produced it (invariant 1).",
  "type": "object",
  "required": ["schema_version"],
  "additionalProperties": false,
  "properties": {
    "schema_version": {
      "type": "string",
      "pattern": "^\\d+\\.\\d+\\.\\d+$",
      "examples": ["0.2.0"]
    },
    "label": { "type": "string" },
    "vol_beta": {
      "type": "number",
      "minimum": 0,
      "default": 0.65,
      "description": "Volatility points added per unit of reference drawdown: 0.65 means +13 points at -20%. A reduced form whose virtue is legibility. It must be swept and never reported bare — the spread between 0 and 1.0 is over four percentage points at -20% on example A."
    },
    "fallback_iv": {
      "type": "number",
      "exclusiveMinimum": 0,
      "maximum": 5,
      "default": 0.2,
      "description": "Volatility for legs supplying neither a mark nor an implied vol. Using it is recorded: the report must be able to say which legs are marked and which are modelled. Defaults to 0.2, which is the constant the oracle applies."
    },
    "held_asset_response": {
      "type": "object",
      "additionalProperties": false,
      "description": "Overrides the structure's own held-asset response. Present by name, never by implicit default (invariant 2).",
      "properties": {
        "beta_down": { "type": "number" },
        "beta_up": { "type": "number" },
        "source": { "type": "string", "enum": ["assumed", "user_supplied"] }
      }
    },
    "decline": {
      "type": "object",
      "additionalProperties": false,
      "description": "The gradual-decline path. A laddered floor performs worst not in a crash but in a slow grind, because each tranche expires while the market is still falling and is replaced below it. This is one hand-built path, not a distribution.",
      "properties": {
        "total_move": {
          "type": "number",
          "exclusiveMinimum": -1,
          "maximum": 0,
          "default": -0.3,
          "description": "Total reference move over the horizon, as a fraction."
        },
        "horizon_days": { "type": "integer", "exclusiveMinimum": 0, "default": 365 },
        "include_call_overlay": {
          "type": "boolean",
          "default": false,
          "description": "A monotone path is the best case for a call writer — no roll is ever assigned — so including the overlay flatters the result substantially. Excluded by default, and the choice is reported either way."
        },
        "replacement": {
          "type": "object",
          "additionalProperties": false,
          "description": "How an expiring floor tranche is replaced. Lives here rather than on the structure because it describes a forward assumption (D-12).",
          "properties": {
            "floor_strike_pct_of_spot": { "type": "number", "exclusiveMinimum": 0, "default": 0.9 },
            "floor_tenor_days": { "type": "integer", "exclusiveMinimum": 0, "default": 365 },
            "floor_iv": { "type": "number", "exclusiveMinimum": 0, "maximum": 5, "default": 0.25 }
          }
        }
      }
    },
    "capture": {
      "type": "object",
      "additionalProperties": false,
      "description": "The upside-capture Monte Carlo. Computed once per report and not draggable (D-20).",
      "properties": {
        "tenor_grid_days": {
          "type": "array",
          "items": { "type": "integer", "exclusiveMinimum": 0 },
          "default": [14, 30, 91],
          "description": "Shorter tenors forfeit less in a trend, because each roll re-strikes from the new level. This is the opposite of what most readers expect and the grid exists to show it."
        },
        "delta_grid": {
          "type": "array",
          "items": { "type": "number", "exclusiveMinimum": 0, "exclusiveMaximum": 1 },
          "default": [0.3, 0.25, 0.2]
        },
        "horizon_days": { "type": "integer", "exclusiveMinimum": 0, "default": 91 },
        "reference_move": { "type": "number", "exclusiveMinimum": -1, "default": 0.152 },
        "reference_vol": { "type": "number", "exclusiveMinimum": 0, "default": 0.16 },
        "overwrite": {
          "type": "number",
          "minimum": 0,
          "description": "Overwritten notional as a fraction of NAV. Defaults to the structure's own observed short-call spot notional."
        },
        "band": {
          "type": "number",
          "exclusiveMinimum": 0,
          "default": 0.02,
          "description": "Capture is conditioned on paths finishing within this band of reference_move. Conditioning rather than taking a raw ratio: a ratio of two small numbers is unstable by construction as the denominator approaches zero. Below 50 conditioned paths the cell returns null."
        },
        "paths": { "type": "integer", "exclusiveMinimum": 0, "default": 20000 },
        "seed": {
          "type": "integer",
          "minimum": 0,
          "default": 11,
          "description": "Every Monte Carlo takes a seed and uses mulberry32 with the specified draw order. A figure that moves between runs is a bug (invariant 6, D-18)."
        }
      }
    },
    "sweep": {
      "type": "object",
      "additionalProperties": false,
      "required": ["parameter", "values"],
      "description": "A sweep is a core function, not a UI behaviour (D-19). The web page renders the result as a slider; the MCP server returns it as a table.",
      "properties": {
        "parameter": {
          "type": "string",
          "enum": ["beta_down", "beta_up", "vol_beta", "reference_move"],
          "description": "Closed-form parameters only. The capture Monte Carlo is not sweepable this way (D-20)."
        },
        "values": {
          "type": "array",
          "minItems": 1,
          "items": { "type": "number" }
        }
      }
    }
  }
}
